data,region,remarks,source,format,status,path_or_action
"Aggregate-unit population and workers","Pangyo Techno Valley Phase 1 / Dongtan Techno Valley","Required for socio-demographic comparison and reachable population/workers inside 30/60 minute transit isochrones. Use the same reference year for both regions.","SGIS Statistical Geographic Information Service API","JSON/GeoJSON/CSV","missing","Collect under data/raw/sgis/ after issuing SGIS consumer_key and consumer_secret."
"Land-use zoning and building registry","Pangyo Techno Valley Phase 1 / Dongtan Techno Valley","Required for zoning composition, building-use composition, land-use mix, floor-area ratio, and undeveloped parcel indicators.","VWorld 2D data API and BuildingHub / data.go.kr building registry APIs","GeoJSON/JSON/XML/CSV","missing","Collect under data/raw/vworld_buildinghub/ after issuing VWorld key and data.go.kr serviceKey."
"Road network","Pangyo Techno Valley Phase 1","OSM highway ways inside the initial Pangyo bbox: 37.386,127.087,37.413,127.125. Replace or clip to official Phase 1 boundary before final reporting.","OpenStreetMap Overpass API","Overpass JSON","collected","data/raw/osm/pangyo_roads_overpass.json"
"Road network","Dongtan Techno Valley","OSM highway ways inside the Dongtan Techno Valley bbox: 37.194,127.071,37.236,127.125 (refreshed to match the final boundary; original bbox 37.260,127.073,37.270,127.099 didn't overlap and returned 0 elements).","OpenStreetMap Overpass API","Overpass JSON","collected","data/raw/osm/dongtan_roads_overpass.json"
"Metropolitan subway network graph","Pangyo Techno Valley Phase 1 / Dongtan Techno Valley","Required for 30/60 minute transit isochrones and cumulative accessibility curves. Use Dongtan Station and Pangyo Station as initial core station candidates unless the final boundary definition suggests otherwise.","LMS-provided subway_network.zip","ZIP with network/nodes.tsv and network/links.tsv","collected outside raw folder","Move or copy subway_network (1).zip to data/raw/subway/subway_network.zip."
"Official analysis boundaries","Pangyo Techno Valley Phase 1 / Dongtan Techno Valley","Required to define the exact analysis area, calculate area, and clip/join all datasets consistently.","District plan notice, project boundary, public planning documents, or official GIS files","PDF/SHP/GeoJSON","missing","Save source documents and derived boundary files under data/raw/boundaries/ and data/processed/boundaries/."
"Low-performance evidence for Dongtan","Dongtan","Required to justify Dongtan as the comparison case. Use quantitative or credible documentary evidence such as vacancy, unsold units, delayed activation, audit findings, reports, or reliable news articles.","Public statistics, audit/research reports, official plans, reliable news","PDF/HTML/CSV","missing","Save source list and extracted facts under data/raw/evidence/."
